{
  "number": 12,
  "topic": "Percentages",
  "domain": "Problem-Solving and Data Analysis",
  "skills": ["Percent of a number", "Percent increase and decrease", "Successive and reverse percent change"],

  "lesson": {
    "intro": "A percent is nothing more than a fraction whose denominator is $100$: $37\\%$ means $\\frac{37}{100}=0.37$. Every percent question on the Digital SAT is one of four questions in disguise --- \\emph{what is $p\\%$ of a number}, \\emph{what percent is one number of another}, \\emph{by what percent did a quantity change}, and \\emph{what was the quantity before it changed}. The last of these, together with two changes applied one after the other, is where most of the points are won and lost, because both reward the multiplier method and punish the instinct to add percents together.",
    "blocks": [
      {
        "kind": "section",
        "title": "Percent of a number, and one number as a percent of another",
        "body": "Translate the English literally. The word \\emph{of} means multiply, the word \\emph{is} means equals, and \\emph{what} means the unknown. So \\textbf{$p\\%$ of $N$} is $\\frac{p}{100}\\cdot N$: $30\\%$ of $250$ is $0.30\\times 250=75$.\n\nRunning the sentence backwards gives the other two questions. \\textbf{What percent is $A$ of $B$?} asks for the number $p$ with $\\frac{p}{100}\\cdot B=A$, so $p=\\frac{A}{B}\\times 100$. And \\textbf{$p\\%$ of what number is $A$?} asks for $N$ with $\\frac{p}{100}\\cdot N=A$, so $N=\\frac{A}{p/100}$. Notice that in \\emph{every} version there is one equation, $\\frac{p}{100}\\cdot N=A$, and you are told two of the three letters."
      },
      {
        "kind": "formula",
        "title": "The four formulas",
        "body": "$$p\\%\\text{ of }N=\\frac{p}{100}\\cdot N$$\n$$A\\text{ as a percent of }B=\\frac{A}{B}\\times 100\\%$$\n$$\\text{percent change}=\\frac{\\text{new}-\\text{old}}{\\text{old}}\\times 100\\%$$\n$$\\text{percent error}=\\frac{|\\text{measured}-\\text{actual}|}{\\text{actual}}\\times 100\\%$$\nIn the last two the denominator is always the \\emph{starting} or \\emph{true} value --- the thing the change is being measured against."
      },
      {
        "kind": "concept",
        "title": "The multiplier method",
        "body": "Do not compute the change and then add or subtract it. Turn the change into a single number you multiply by:\n$$\\text{an increase of }p\\%\\ \\longrightarrow\\ \\times\\left(1+\\tfrac{p}{100}\\right),\\qquad \\text{a decrease of }p\\%\\ \\longrightarrow\\ \\times\\left(1-\\tfrac{p}{100}\\right).$$\nA $15\\%$ increase is $\\times 1.15$; a $15\\%$ decrease is $\\times 0.85$; adding an $8\\%$ tax is $\\times 1.08$; taking $40\\%$ off is $\\times 0.60$.\n\nThis one habit pays for itself three times over. It makes a single change a one-step calculation, it makes two changes in a row a product, and --- because multiplying is reversible --- it turns every \\emph{reverse} percent question into a division."
      },
      {
        "kind": "worked",
        "title": "Worked example 1 --- a discount, then the percent change",
        "body": "\\textbf{A sweater priced at $\\$85$ is marked down to $\\$68$. By what percent was the price reduced, and what single number could the store have multiplied the old price by?}\n\n\\emph{Percent change.} The change is $68-85=-17$ dollars, and the change is measured against the \\emph{old} price, $85$:\n$$\\frac{68-85}{85}\\times 100\\%=\\frac{-17}{85}\\times 100\\%=-0.20\\times 100\\%=-20\\%,$$\na $20\\%$ decrease.\n\n\\emph{Multiplier.} A $20\\%$ decrease is $\\times(1-0.20)=\\times 0.80$, and indeed $85\\times 0.80=68$. \n\nThe check is worth doing every time: if your percent change is right, the old value times the multiplier must land exactly on the new value. Had you divided by $68$ instead of $85$ you would have gotten $25\\%$, and $85\\times 0.75=63.75\\neq 68$ --- the check catches the error immediately."
      },
      {
        "kind": "section",
        "title": "Successive change: percents do not add",
        "body": "When one change follows another, the second percent is taken of the \\emph{new} amount, not of the original. So you multiply the multipliers:\n$$\\text{final}=\\text{original}\\times m_1\\times m_2.$$\nA $20\\%$ rise followed by a $20\\%$ fall gives $1.20\\times 0.80=0.96$: the quantity ends at $96\\%$ of where it started, a $4\\%$ \\emph{net loss}, not a return to the beginning. A $10\\%$ rise then another $10\\%$ rise gives $1.10\\times 1.10=1.21$, a $21\\%$ increase --- not $20\\%$.\n\nTwo consequences worth memorising. A rise of $p\\%$ and a fall of $p\\%$, in either order, always leaves you \\emph{below} the start. And to undo a $p\\%$ fall you need a rise of \\emph{more} than $p\\%$: after a $20\\%$ drop the multiplier is $0.8$, so the recovery multiplier is $\\frac{1}{0.8}=1.25$, a $25\\%$ rise."
      },
      {
        "kind": "trap",
        "title": "The three mistakes the test is fishing for",
        "body": "\\textbf{1. Adding the percents.} \"$30\\%$ off, then $10\\%$ more off\" is not $40\\%$ off. It is $\\times 0.70\\times 0.90=\\times 0.63$, i.e. $37\\%$ off. The choice built from $40\\%$ is always sitting there.\n\n\\textbf{2. Dividing by the wrong value.} Percent change and percent error use the \\emph{original} (or \\emph{actual}) value as the denominator. Going from $200$ to $250$ is a $\\frac{50}{200}=25\\%$ increase, not $\\frac{50}{250}=20\\%$.\n\n\\textbf{3. Multiplying when you should divide.} If a price is $\\$68$ \\emph{after} a $15\\%$ discount, the original is $\\frac{68}{0.85}=80$, not $68\\times 0.85=57.80$ and not $68\\times 1.15=78.20$. The $\\$68$ is the output of the multiplication, so you must undo it."
      },
      {
        "kind": "concept",
        "title": "Reverse percent: work backwards through the multiplier",
        "body": "Whenever a question gives you the value \\emph{after} a change and asks for the value \\emph{before}, name the original $x$, write the forward sentence, and solve:\n$$x\\cdot m=\\text{known value}\\quad\\Longrightarrow\\quad x=\\frac{\\text{known value}}{m}.$$\nThe skill is entirely in writing $m$ correctly: \"after a $15\\%$ discount\" gives $m=0.85$; \"including a $6\\%$ tax\" gives $m=1.06$; \"after a $20\\%$ increase and then a $10\\%$ decrease\" gives $m=1.20\\times 0.90=1.08$.\n\nA fast sanity check: after an increase the original must be \\emph{smaller} than the number you were given; after a decrease it must be \\emph{larger}. If your answer is on the wrong side, you multiplied instead of dividing."
      },
      {
        "kind": "worked",
        "title": "Worked example 2 --- reverse and successive together",
        "body": "\\textbf{A retailer raises the price of a bicycle by $25\\%$, then puts the raised price on sale at $20\\%$ off. The sale price is $\\$150$. What was the price before the increase?}\n\n\\emph{Step 1: build the multipliers.} An increase of $25\\%$ is $\\times 1.25$; a discount of $20\\%$ is $\\times 0.80$.\n\n\\emph{Step 2: write the forward equation.} With $x$ the original price,\n$$x\\times 1.25\\times 0.80=150.$$\n\n\\emph{Step 3: combine and divide.} $1.25\\times 0.80=1.00$, so $x=150$. The two changes cancelled exactly --- which happens here only because $\\frac{1}{1.25}=0.80$, i.e. because $20\\%$ is exactly the discount that undoes a $25\\%$ increase.\n\nThat coincidence is itself a favourite SAT question: \\emph{after raising a price by $25\\%$, what percent discount returns it to the original?} The answer is not $25\\%$. The needed multiplier is $\\frac{1}{1.25}=0.80$, so the discount is $20\\%$."
      },
      {
        "kind": "strategy",
        "title": "Strategy and calculator use",
        "body": "\\textbf{Pick $100$.} When a question is entirely in percents with no numbers attached (\"the final value is what percent of the original?\"), let the original be $100$, run the multipliers, and read the answer straight off. A $20\\%$ rise then a $25\\%$ fall: $100\\to 120\\to 90$, so the final value is $90\\%$ of the original, a $10\\%$ decrease.\n\n\\textbf{Keep everything as one product.} Type $120\\times 0.7\\times 0.9$ in one go rather than rounding an intermediate price; percent answers on the SAT are exact, so a rounded middle step is what turns $75.60$ into a wrong choice.\n\n\\textbf{Read what is being asked for.} Questions alternate between \"what is the final amount\", \"what is the percent change\", and \"the final is what percent of the original\". Those are three different numbers --- $90$, $-10\\%$ and $90\\%$ in the example above --- and all three are usually among the choices."
      }
    ]
  },

  "problems": [
    {
      "id": "T12-M1-01",
      "module": 1,
      "n": 1,
      "difficulty": "E",
      "type": "MC",
      "skill": "Percent of a number",
      "stem": "What is $30\\%$ of $250$?",
      "choices": ["$7.5$", "$75$", "$175$", "$750$"],
      "answer": "B",
      "steps": ["Write $30\\%$ as $\\frac{30}{100}=0.30$.", "The word \\emph{of} means multiply: $0.30\\times 250=75$."],
      "solution": "A percent is a fraction over $100$, so $30\\%$ of a quantity is $0.30$ times that quantity. Choice A is $3\\%$ of $250$ and choice C is what is left after removing $30\\%$; the question asks for the part itself, not the remainder.",
      "verify": "result = Rational(30,100)*250"
    },
    {
      "id": "T12-M1-02",
      "module": 1,
      "n": 2,
      "difficulty": "E",
      "type": "SPR",
      "skill": "What percent one number is of another",
      "stem": "$45$ is what percent of $180$? (Disregard the percent sign when entering your answer.)",
      "answer": "25",
      "steps": ["Translate: $\\frac{p}{100}\\cdot 180=45$.", "Divide the part by the whole: $\\frac{45}{180}=0.25$.", "Multiply by $100$ to express the ratio as a percent: $25$."],